{
  "entities": [
    {
      "name": "DynamicDagExecutionControl",
      "transitions": [
        {
          "from": "received",
          "to": "validated",
          "event": "validate",
          "status": "missing",
          "verified_at": "2026-08-22T05:47:20.238927+00:00"
        },
        {
          "from": "received",
          "to": "failed",
          "event": "reject_invalid",
          "status": "missing",
          "verified_at": "2026-08-22T05:47:20.239030+00:00"
        },
        {
          "from": "validated",
          "to": "pending_approval",
          "event": "queue_approval",
          "status": "missing",
          "verified_at": "2026-08-22T05:47:20.239031+00:00"
        },
        {
          "from": "validated",
          "to": "admitted",
          "event": "admit_validated",
          "status": "missing",
          "verified_at": "2026-08-22T05:47:20.239032+00:00"
        },
        {
          "from": "validated",
          "to": "failed",
          "event": "reject_policy",
          "status": "missing",
          "verified_at": "2026-08-22T05:47:20.239033+00:00"
        },
        {
          "from": "pending_approval",
          "to": "validated",
          "event": "approve_and_revalidate",
          "status": "missing",
          "verified_at": "2026-08-22T05:47:20.239034+00:00"
        },
        {
          "from": "pending_approval",
          "to": "failed",
          "event": "reject_or_expire",
          "status": "missing",
          "verified_at": "2026-08-22T05:47:20.239035+00:00"
        },
        {
          "from": "admitted",
          "to": "claimed",
          "event": "claim_ready",
          "status": "missing",
          "verified_at": "2026-08-22T05:47:20.239036+00:00"
        },
        {
          "from": "admitted",
          "to": "cancelled",
          "event": "cancel_before_dispatch",
          "status": "missing",
          "verified_at": "2026-08-22T05:47:20.239037+00:00"
        },
        {
          "from": "claimed",
          "to": "running",
          "event": "worker_started",
          "status": "missing",
          "verified_at": "2026-08-22T05:47:20.239038+00:00"
        },
        {
          "from": "claimed",
          "to": "expired",
          "event": "lease_expired_before_start",
          "status": "missing",
          "verified_at": "2026-08-22T05:47:20.239038+00:00"
        },
        {
          "from": "claimed",
          "to": "failed",
          "event": "dispatch_failed_permanently",
          "status": "missing",
          "verified_at": "2026-08-22T05:47:20.239039+00:00"
        },
        {
          "from": "claimed",
          "to": "cancelled",
          "event": "revoke_before_start",
          "status": "missing",
          "verified_at": "2026-08-22T05:47:20.239040+00:00"
        },
        {
          "from": "running",
          "to": "succeeded",
          "event": "publish_success",
          "status": "missing",
          "verified_at": "2026-08-22T05:47:20.239041+00:00"
        },
        {
          "from": "running",
          "to": "failed",
          "event": "publish_failure",
          "status": "missing",
          "verified_at": "2026-08-22T05:47:20.239041+00:00"
        },
        {
          "from": "running",
          "to": "blocked_safe",
          "event": "pause_or_block_at_safe_boundary",
          "status": "missing",
          "verified_at": "2026-08-22T05:47:20.239042+00:00"
        },
        {
          "from": "running",
          "to": "expired",
          "event": "lease_expired",
          "status": "missing",
          "verified_at": "2026-08-22T05:47:20.239043+00:00"
        },
        {
          "from": "running",
          "to": "cancelled",
          "event": "cancel_at_safe_boundary",
          "status": "missing",
          "verified_at": "2026-08-22T05:47:20.239044+00:00"
        },
        {
          "from": "blocked_safe",
          "to": "claimed",
          "event": "unblock_and_reclaim",
          "status": "missing",
          "verified_at": "2026-08-22T05:47:20.239045+00:00"
        },
        {
          "from": "blocked_safe",
          "to": "cancelled",
          "event": "cancel_blocked",
          "status": "missing",
          "verified_at": "2026-08-22T05:47:20.239045+00:00"
        },
        {
          "from": "blocked_safe",
          "to": "failed",
          "event": "liveness_failure",
          "status": "missing",
          "verified_at": "2026-08-22T05:47:20.239046+00:00"
        }
      ]
    }
  ],
  "generated_at": "2026-08-22T05:47:20.239048+00:00",
  "repo": "/Users/patwork/repos/chief-wiggum/.codex/worktrees/feat-383-dynamic-dag-ox-alpha",
  "applicability": "applicable",
  "outcome": "findings",
  "measured": {
    "source_files_scanned": 9,
    "unreadable_files": 0,
    "model_files_loaded": 1,
    "model_files_requested": 1,
    "model_transitions": 21,
    "code_matches": 0
  },
  "errors": [],
  "summary": {
    "total_model_transitions": 21,
    "covered": 0,
    "missing": 21,
    "undocumented": 0
  }
}